,segment_id,segment_avg_logprob,segment_compression_ratio,segment_no_speech_prob,seek,start,end,temperature,text,tokens,nltk_opinion_lexicon_positive,nltk_opinion_lexicon_negative,nltk_opinion_lexicon_net,vader_neg,vader_neu,vader_pos,vader_compound
0,0,-0.26126453280448914,1.6342592239379883,0.021251950412988663,0,0.0,5.159999847412109,0.0, I wanted to say a few words about our president. Joe Biden's legacy of accomplishment over,"[50364, 286, 1415, 281, 584, 257, 1326, 2283, 466, 527, 3868, 13, 6807, 9877, 311, 11711, 295, 29144, 670, 50622]",0.0625,0.0,0.0625,0.0,1.0,0.0,0.0
1,1,-0.26126453280448914,1.6342592239379883,0.021251950412988663,0,5.159999847412109,13.399999618530273,0.0," the past three years is unmatched in modern history. In one term, he has already, yes,","[50622, 264, 1791, 1045, 924, 307, 19334, 24102, 294, 4363, 2503, 13, 682, 472, 1433, 11, 415, 575, 1217, 11, 2086, 11, 51034]",0.125,0.0,0.125,0.072,0.778,0.15,0.34
2,2,-0.26126453280448914,1.6342592239379883,0.021251950412988663,0,13.399999618530273,24.079999923706055,0.0," you may clap. In one term, he has already surpassed the legacy of most presidents who","[51034, 291, 815, 20760, 13, 682, 472, 1433, 11, 415, 575, 1217, 27650, 292, 264, 11711, 295, 881, 27611, 567, 51568]",0.0,0.0,0.0,0.0,1.0,0.0,0.0
3,3,-0.26126453280448914,1.6342592239379883,0.021251950412988663,0,24.079999923706055,29.600000381469727,0.0, have served two terms in office. And I first came to know President Biden through his son,"[51568, 362, 7584, 732, 2115, 294, 3398, 13, 400, 286, 700, 1361, 281, 458, 3117, 9877, 807, 702, 1872, 51844]",0.0,0.0,0.0,0.0,1.0,0.0,0.0
4,4,-0.22507181763648987,1.6354166269302368,0.00030949802021496,2960,29.600000381469727,35.52000045776367,0.0, Beau. We worked together as attorneys general in our states. And back then Beau would often,"[50364, 43702, 13, 492, 2732, 1214, 382, 30019, 2674, 294, 527, 4368, 13, 400, 646, 550, 43702, 576, 2049, 50660]",0.0625,0.0,0.0625,0.0,1.0,0.0,0.0
5,5,-0.22507181763648987,1.6354166269302368,0.00030949802021496,2960,35.52000045776367,43.119998931884766,0.0, tell me stories about his dad. He would talk about the kind of father and the kind of man,"[50660, 980, 385, 3676, 466, 702, 3546, 13, 634, 576, 751, 466, 264, 733, 295, 3086, 293, 264, 733, 295, 587, 51040]",0.0,0.0,0.0,0.0,1.0,0.0,0.0
6,6,-0.22507181763648987,1.6354166269302368,0.00030949802021496,2960,43.119998931884766,50.560001373291016,0.0, that Joe Biden is. The qualities that Beau revered in his father are the same qualities,"[51040, 300, 6807, 9877, 307, 13, 440, 16477, 300, 43702, 18438, 292, 294, 702, 3086, 366, 264, 912, 16477, 51412]",0.0,0.0,0.0,0.0,0.82,0.18,0.5106
7,7,-0.22507181763648987,1.6354166269302368,0.00030949802021496,2960,50.560001373291016,53.84000015258789,0.0, that I have seen every day in our president.,"[51412, 300, 286, 362, 1612, 633, 786, 294, 527, 3868, 13, 51576]",0.0,0.0,0.0,0.0,1.0,0.0,0.0
